id,comment_id,text,pos_f,pos_m
0,31755,"For my brave girls all over the world defying modesty/rape culture and choosing personal freedom, I'm proud of you. I honor you. I see you, and I admire you. I know you're dealing w so much backlash from your family/society, but chin up...and spread those gorgeous wings",0,0.035714286
1,16800,"Absolutely! I used to think women and men were equal in emotional content but boy was I wrong. I have seen my mom and sister struggle with emotions but when I saw my own daughter struggle I realised that being a girl and going through puberty is an emotional roller coaster that I could not handle personally. Great respect for all the women in my life, including the transgenders. I love you all!",0.01754386,0.08
2,25681,A study shows that girls are fearing becoming leaders because of discrimination and violence. Our message must be that every girl has the potential to be leader. We have to empower every girls power. #GenderEqualWorld.  URL @angel4many @nailaemt,0,0.018518519
3,40476,Women are just as capable as men indeed they make great mothers and warriors. If anyone tells you otherwise they might start to make sense but just be assured they are in the wrong because respect whamenz.,0.081967213,0.240740741
4,36248,"Happy women's month. Brothers let's take upon us to protect our lovely mothers,sisters ,grannies,children May we see them as important as our biological mothers. Let's break the record 2019-2020",0.02,0.018181818
5,42769,I believe what makes a women beautiful is her belief in herself in every way. Has self confidence and a strength over and above board. Loves helping and giving from the goodness of her heart. That's a very beautiful women!,0,0.015384615
6,24206,Ethiopia is leading the way with gender parity in government but Sahle-Work Zewde the first female president of Ethiopia says that the work has just begun. She wants to push the limit of what can be done for gender equality and women empowerment. #WD2019 ,0,0.039215686
7,46044,"The question isn't about whether female soccer players should be getting as much $ as men soccer players, because it's a lucrative career either way, and limited by viewership and advertisement. The real question is this (and it affects all women, not just the rich ones): why is the US the only advanced economy that doesn't federally mandate paid maternity leave? Why aren't women being empowered to seek promotions, or to flee from abusive relationships and exploitative working conditions?",0.056603774,0.039215686
8,44436,KEEP SLAYIN LADIES!! You speak for ALL of us who want a voice. ANY of us who want the world we deserve. Thes women are OUR sisters. Stand with them,0,0
9,40751,"Yes every girl can be independent, successful, and inspiring, and also try to be the best role model she can ever be for her children and the next generation ..",0,0.039215686
10,36036,@StefanMolyneux And let's not forget the statistics about domestic partner violence... more often initiated by women than men.,0.186440678,0.236363636
11,11953,"Chicks who basically get fame and money simply through their attractiveness. They are streamers or YouTubers who literally have no appeal other than the fact they are hot. Might as well go the whole hog, no?",0.736842105,0.527272727
12,12192,"I'm a guy who likes women. In general I prefer women who present feminine, so alternative style may turn me off. As fair as hair color goes: it depends! I've seen a lot of women color their hair in a way that just isn't flattering given the color & style. I've also seen women color their hair in a way that's wonderful and attractive. I think the main difference is the degree of care going into the hair in question; the colored hair I find attractive seems healthy and full even if it's been colored.",0.039215686,0.033333333
13,25632,"@BadassBowden @Ch33r10 You want bad ass women? You want feminism ? Then stop asking strangers to pay for your vacation. You are women, earn the money and pay for it yourselves. It will feel better to do it that way.",0.596153846,0.622641509
14,25668,"There are women actually being raped and too scared to say anything because nobody will believe them. It's absolutely disgusting that someone would lie for profit. Not only do you make yourself look bad, but you make it so much harder for a lot of victims of rape.",0.094339623,0.057692308
15,49738,"""..several pregnant women were denied bathroom breaks.."" ""..Amazon says that they took into consideration and allowed extra breaks for pregnant women.."" These paraphrases offer interesting insight into the ""gender pay gap"" phenomenon. Pregnancy is among the top, if not the priamry, reason there appears to be a gender pay gap. A small study recently revealed that trans women (man to woman) don't suffer the same gap. Curious no?",0.1,0.115384615
16,1342,"Not all of them, however. And last time I checked, other societies are more focused on keeping women in the house and out of the freedom's of the world. You're aware you're in Canada right? See the women driving and walking around? Having jobs? Being visible and not covered in cloaks? Not being chattel?",0.117647059,0.132075472
17,19075,"Well it could be worse. The last woman she was that jealous of, she tried to get her son to have sex with when she was definitely too drunk to consent.",0.545454545,0.407407407
18,44985,+ChurizoMcBurrito Pass laws that help the mothers before you force them to have babies. That fact you can't see this is even more despicable.,0.264150943,0.269230769
19,10863,"Thanks for bringing a voice of logic and reason here.  If we chopped off the labias of young girls, people would lose their shit, but apparently circumcision is fine?",0.526315789,0.357142857
20,36140,"Look how gorgeous @MissMelodyMay is, She truly is a Goddess. Her beauty makes you want to pay, and when you pay your mind gets erased for her @rt_bex @rt_slave1 @RT_findombrats @RTslave25 @RTMadameEllie @RTPromo4U @RT_Pig",0.156862745,0.089285714
21,40363,"Wait edgy content on YT era is over, why only feminists can do edgy shit?  Idubz just hashtag feminist in your next content cop and you ll be fine.",0.74137931,0.589285714
22,38089,My timeline be full of hating asses sometimes like why do some girls love hating on other girls theirs so many baddies out there y'all be mad cause y'all wanna feel better all the time like nooo  everyone's beautiful but ok go off,0.471698113,0.50877193
23,17479,Girls: I needs a man with a bigger dick! Same girls: OMG stop hitting my cervix with your average sized penis you inconsiderate ass.,0.810344828,0.87037037
24,24239,"some of these female rappers trash , they just say hoe shit and it make y'all females feel good about being hoes .",0.86440678,0.814814815
25,6572,"She killed another human, her own kid and she's smiling.  No. Women think it's a joke to be arrested. They know they will get off light.",0.557692308,0.576923077
26,42862,"You know it's funny how these four Congress women aren't being held accountable for their stupidity remarks. Here's how they work for the dummies that put them in office , from what these women say it's makes me believe that they are terrorist",0.79245283,0.698113208
27,31824,"@knowlesjulie67 @shoreytime @australian @georgiedent @bowledgary @RobertOvadia @xhertx @NStottDespoja If only the government didn't listen to feminist who inherently hate women, perhaps this mother would be alive. Domestic violence is about violence and not about gender. It's a shame women like Julie cannot recognise that",0.320754717,0.355932203
28,8799,Oh yeah simple girl logic.you have no clue who I am or what girls I fuck so without any clues or evidence you just have to say that I have never spoken to a woman.  Wow woman these days are so clever,0.981481481,0.9
29,33971,"@PaulTassi ..by women to create a competitive movement. Most female teams practice less, take it less serious, play in female only leagues or events, and aren't trying to truly elevate themselves to be apart of one inclusive community where they are pushed.",0.385964912,0.333333333
30,5606,"I've noticed the prettier the wahmen, the bigger the bitch. Ignoring women is my super-power. I'm like an Avenger but more asshole. Or Avenging Asshole if you will.",0.948275862,0.983050847
31,12382,"All women should experience what it's like to take two cocks in one hole. This woman has definitely taken a few cocks in her time, those cocks go in with ease. She could probably take three.",0.945454545,0.945454545
32,25852,"Girls are so extra dramatic when they get mad. Everything is ""Bye, delete my number, l'm done, l hate you, You won't hear from me no more, have a blessed life, leave me alone and they sit there waiting for a reply",0.5,0.508474576
33,42038,""" Pray for him"" ha! The filthy traitor would burst into flames if she tried. Only altar that old bag ever prayed at is the altar of the cocks she sucked to get to where she is.",1,0.981132075
34,36176,"Spread your legs for me, slut. You better listen to daddy and do as you're told. Not unless you want to be punished. Fucking whore.",1,0.96
35,1212,"Lick her face, spit roast her, pull her hair behind and fuck her mouth. Spread her legs, choke her while breeding her after pounding her little cunt.",0.983870968,0.901960784
36,4231,"Mmm I want to face fuck middle, then fuck her tits and explode all over her. Ruin her clothes, makeup and hair with cum!",1,0.921568627
37,21596,"Women so fucking retarded. Before you tell me wha I doing wrong or right you gine sit dey pon the bed like a dead star fish then go home and tweet "" tired having lame sex"" yuh mudda girl",0.98245614,0.980769231
38,47508,Why are women like this so stupid? I swear you idiots look for douchbags! All I want is a nice guy. Bullshit! Just be honest you women love a man that's a train wreck!,0.921568627,0.949152542
39,48523,"Once again trying to feminise another great male movie, so I'm thinking they want to ruin everything male and put some dumb bitch that no one wants to see, I've had it with this, what spaces do we have left? MYSELF AND MOST REAL MEN HAVE HAD IT AND IM NOT WATCHING THIS FILTH",0.941176471,0.811320755
40,12926,You are a filthy slut who dresses up to get attention and make mens' cocks hard. You like exposing yourself like this because it makes you horny thinking of men wanting to fuck you. How much of a slut is that?,0.962962963,1
41,4343,The only people who are proud of the ugly dog who did this are ugly stupid women on the internet. Thank god they all abort their kids.,0.962962963,0.981481481
42,34583,how pathetic can you get hm pup? all i did was say a few words and already you're practically begging me to use your tight hole like a fuck toy. you're such a worthless whore whining for my cock. now get on your knees and show me what else that slutty mouth can do.,0.982758621,0.960784314
43,37617,"i wanna fuck someone until they're sobbing and shaking, begging for me to fuck them harder... poor pathetic slut wouldn't know when to stop, poor dumb whore wouldn't ever want me to stop.",0.982142857,0.921568627
44,44143,All they prove to be is a bunch of fruitless lacking morals overloaded estrogen driven bitches! All of them are USELESS to any society!,0.981481481,0.945454545
45,45196,I want to slap that stupid woman right in big fat lying narcissistic racist puss filled mouth. Shut up!!! This is MY country TOO!!!,1,0.951612903
46,4814,"You are a useless cunt. The only reason you get my cum is because I'm bored with other pussy and it's fun slapping your face while I throat fuck you, looking up at me with tears in your eyes while I'm laughing at what a useless hole you are",1,0.981818182
47,9461,"Rip off that nightie and shove my cock down your throat until you passed out, then slap you awake and do it again. After a few times of that I would rape your ass while slapping your tits and spanking your pathetic, rape hungry cunt.",0.981132075,1
48,14855,"I'd like to bring 3-4 friends and gang bang her, DP her, spit roast her and pump her holes full of load after load of cum.",0.981481481,0.882352941
49,3764,"with you like that acting the little cum slut, first your pussy will be used then after you clean my cock up, I will have your asshole",1,0.941176471
50,16777,"Its a woman doing or in charge of the documentary. Dont watch it guys, all women are evil and AWALT. I bet she wouldnt care if men in her family, husband if she has one, father, uncles, grandfather or son killed themselves. Shes a woman in the end so that means she is subhuman and the same as every other slut in 20s and 30s now. Btw your moms and grandmoms who give you advice not to marry in these times are hoes and AWALTs too. /s btw I consider myself mgtow 110% but not everything in life is black and white. There are exceptions to the rule.",0.963636364,0.963636364
51,29677,"How to say ""stupid dumbass hoe, bitch, slut, cunt, victim player, voting enthusiast, billboard enthusiast, immature, mocker"" in a word? Army",0.980769231,0.93220339
52,13499,"The only thing Alinity has going for her as a human being is her sexuality, if she werent a moderately attractive Thot, she would be begging on the street for scraps like the rest of us. She is a human sex toilet, nothing more. If i had the chance i would split her crainium in a hundred pieces and drink her cursed blood from her skull.",0.98245614,0.98245614
53,15436,You fucking little dirty whore I bet you fucker dick you can by the way your pussy looks I can tell you get fucked every chance you get your fucking nasty slut go stick your head in the fucking toilet whore wife fuck you up your ass mikedance858 on kik,1,1
54,2290,"Thinking that all women are whores who will do this is wrong Yet it is still your safest bet. Women are fucking terrible. That's why they all hate each other. You'd hate them, too, if you didn't want to ram your cock in-and-out of them.",0.980769231,0.962264151
55,4145,Weak ass bitch gonna cry again. Just like you cried when you realized you're not even good at being a whore and couldn't even handle a light beating,1,1
56,8524,That arsehole clearly needs to be broken in before anyone can get pleasure in it.  A week of forced fucking on a fuck machine should get it ready to be used by a real cock.  Then we can move on to your cunt. That thing clearly has next to no cock miles on it. Yet.....,1,0.96
57,32547,"To whom who sent this, you're incapable of thinking straight na. You're a useless, negative and satanic bitch who doesn't have the right to live. Take away your own life beyotch.",0.983333333,1
58,20259,"Careful what you wish for, you always wanted to feel a huge black cock up your hole bitch so now scream, cry all you want that ain't gonna stop this bull from raping your boipussy apart he'll only stop when he is done and shoots his huge load deep inside. ",0.981481481,0.943396226
59,1361,"You live in a vagina, that makes sense since you are a lil baby bitch lmao you know those screams you hear from upstairs and think it's just the tv? It's just me fucking your sister and moms brains out",1,0.982758621
60,28533,"My new blog - comment, share, let's raise awareness of the huge issue of Male Mental Health #selfcare #mentalhealth #mindset",0,0
61,5325,Oh... I see. Poor lad that's nothing to be ashamed of. Your special lady won't care that your not the tallest in your family. It's your personality that will matter the most.,0.036363636,0.036363636
62,14174,"Yep, there is still a great deal of resistance to men who want to be nurses or teachers or daycare workers. That's why it's all the more important to foster opportunities for men to grow into these positions. Representation matters.",0,0.06
63,9248,"Glad you've found you're thing!  It's great to have CIS men in the community that have accepted their attraction and love for us, Infact it takes alot strength to accept that within yourself. I'd be glad to have you fap over my content whenever you please",0.090909091,0.113207547
64,27951,"#InternationalMenHealthWeek, celebrated in several countries to focus on issues facing men's health. Take a look at this article and let's talk",0,0
65,19640,He makes more money than that already. He's shown he's worth more than that just with his playmaking and defense alone. 3/45 is more reasonable,0.016666667,0.111111111
66,19917,I'm a guy and I say this is bullshit. I'm a complex dude. I have lots of emotions. Men are only simple because they've been trained to be that way and surpressed their true selves.,0.153846154,0.275862069
67,15633,"Yes, stereotyping all Redditors as male isn't the best, but that doesn't mean it's malicious. It's 2019. This isn't an excuse anymore.",0.039215686,0.086206897
68,11982,"How can they all say ""kill you male child""? Don't you have to have intercourse with a ~~monster~~ man to have a child in the first place?",0.75862069,0.592592593
69,1419,"I'm a man and I've dealt with other dudes man spreading my whole life bits fucking weird that someone needs their legs wide as fuck. Baseball games and sitting in packed meetings are the worst when you've got a guy spreading his legs far enough for two seats. If multiple people are complaining about it, both men and women, it's probably an issue.",0.596491228,0.470588235
70,13945,Fuckboys are men who manipulate and lie to people to get sex from them. I haven't seen evidence of Nick ever doing that.,0.406779661,0.426229508
71,44029,"None of this makes sense, including the fact that he is having a press conference discussing a case that is going to trial again. Or is that yet another show of his complete incompetence?",0.150943396,0.160714286
72,6708,"Actually this is what I've noticed... Especially when it comes to guys who will message you every second day asking you for more pics, but continue making excuses about why they can't meet up.",0.072727273,0.071428571
73,20085,"Men think that they can get away with this sort of behaviour when they pick on women. In this case, apart from the fact that I'm surprised he can actually string a coherent sentence together, there's now an opportunity to identify & charge him @anitasethi ",0.322033898,0.428571429
74,16053,"Do you know how I know that the incel dogma is false? Brendio's not even that bad looking - the only reason he hasn't got a gf (I assume he's not LGBTQ+, crucify me) is that his personality is toxic.",0.482142857,0.36
75,11575,Yeah all those alpha males going out and beating/killing women's husbands in order to rightfully take their place in the social order and killing her kids to ensure only his kids thrive... Oh wait you're full of shit!,0.854545455,0.826923077
76,16341,"This is literally the dumbest shit every posted online. I can my iq leaking out me just because i read it. The self inflicted pain i endured reading past the ""note to males"". I should have known better...but here we are.",0.796296296,0.862745098
77,26962,"Men these days complain of the quality of women these days, but consistently ghost good girls their age for dumbass 20-yr olds...",0.471698113,0.56
78,3693,"I mean, you don't have to be misogynistic to be a lazy, selfish asshole. I'm sure he's such a feminist that he'd take advantage of you if you were a man, too.",0.814814815,0.771929825
79,9353,"the currently accepted by most definition of incel is one of those guy that likes to wallow in self pitty, hate woman and all that, is that what you want? to stop being one of those guys? Or do you want to get a girlfriend?",0.36,0.245283019
80,48419,Bro you are fuckin sick! You need to go to therapy... Enjoying and laughing at this shit. If I had you face to face I would knock your empty head.. Son of a bitch,0.923076923,0.928571429
81,30112,Jesus fed 5000 people and died a virgin...some man carry a woman go KFC one time & want pums....Be like Jesus to man!!! Cho ,0.482142857,0.517241379
82,16247,Unfortunately for Trudeau politics and negotiation isn't just playing dress up. Either he is extremely dumb or he thinks others are extremely dumb who will get impressed by a white man playing dress up.,0.509803922,0.547169811
83,15078,The majority of people who think about chad and tyrone is incels. And it's also sad how they expect women to date them despite them calling them foids (a.k.a subhuman).,0.574074074,0.44
84,2472,"I can respect that. No pretending to want more than a casual fuck. No games. No begging or reeing when turned down. It's embarrassing to be with someone like that, but I think it's more second hand cringe than anything. It's the guys who expect bobs and vegene photos for basic social niceties on social media and at least a blow job for coffee/dinner then REEE and MGTOW when they're turned down that are horrible people.",0.615384615,0.466666667
85,35740,Guys will really try to gas light you into an uncomfortable situation where you'll likely end up forced or cohersed into having sex with them and not see how they're wrong.,0.26984127,0.362068966
86,8505,"Because dysphoria is a condition affecting the brain and hormone and endocrine systems, not the fucking genitalia, you fucking butcher.",0.912280702,0.884615385
87,4669,"Numale, please. ""yikes""? You need to get off the pussy, man. You need to cleanse yourself. Too much pussy will make a man become a woman (and vice versa). Check out ol' Steve T. He has 200+ slay count, and it really shows as well: URL Duh duh, duh duh duh duh. One of my all-time favourite vids.",0.888888889,0.884615385
88,10382,"So let me get this straight, your definition of a real man is a bitch that gets in his car and yells some insults then runs away?  lamo, stick to the soy/hipster haunts. Thats the only place you can get away with that kind of bullshit.",0.857142857,0.811320755
89,29049,@Lookie_Looks @TutorCambodia And it's the men who complain condoms are too tight but can be stretched out to fit over their neanderthal skull.,0.58490566,0.68
90,7433,"Ever notice how when a bunch of male characters show up, you never notice how it's just a solid group of guys? But when it's all women, suddenly you're triggered into oblivion? Yeah, that's because you're insecure as hell and you're broadcasting it everywhere you go. Dude, you got a problem, we see you got a problem. But why do you guys insist on making your problem everyone else's problem? I get that in the old days you incels could go be monks and circlejerk in a monestary somewhere, but shit. Isn't that what that Bannon fellow's trying to set up for you? Go help him with that.",0.589285714,0.655172414
91,10968,"Tbf, r/MGTOW used to be a cool place about not relying on sexuality to live a good life until r/incels got banned and they all migrated. Now it's a shithole of supreme gentlemen who can't get laid.",0.607843137,0.634615385
92,13811,"Men are delusional. If he pays well, pretend that he's the only one you're seeing. Make him wear a condom though sis EVERY TIME. Be a bigger clown than him. ",0.653846154,0.736842105
93,35021,"boys b rly trippin i'm not responsible for ur lack of courage pls don't come at me cos u didn't shoot ur shot ""bUt u sHouLd hAve kNown"" my ass!!! go back to ur gf la tell me now 4 what?? LOL damn joke",0.603773585,0.603448276
94,11214,Incels want a virgin who will do any freaky sex act they want and be totally into it despite the guy being repellent in personally and hygiene.,0.66,0.74
95,33425,Men are the easiest little games to play. I will always win. I'm too skilled at manipulation. #findom #paypig #domme #findomme #brat #finsub ,0.709090909,0.716981132
96,19865,All I can hear is a baby crying when I read this post. YTA because you sound like a sad incel who just wants other sad incels to be bitter that women exist and aren't sleeping with you.,0.769230769,0.78
97,23135,I've had less pussy than 95% of men on this app and aint half as desperate as some of you weaklings. You pussified faggots get a drop of pussy juice and go crazy,0.95,0.982758621
98,20563,This man is just a disgusting human. This woman supported you for YEARS looked after your dumb drugged up ass like ur a kid only for him to insult her publicly every few months. MEN ARE TRASH,0.879310345,0.946428571
99,2137,Right??? It's REDDIT. Guys come here FOR PORN. Ohhh what a great bastion of intellectual accomplishment!!!! Truly a place where intellectual giants gather to discuss the most fundamental issues of our time : how to encourage the pretty white chick to post even more pics of her anus and what their Paypal password is to pay this prostitute. WOW!! Reddit - a fortress of geniuses.,0.836065574,0.74
100,29157,"@RobertFoster4MS You are a tiny little man with a tiny little penis afraid of what you might do when you're alone with a woman. You deserve every ounce of mockery, you fuckstick.",0.967213115,1
101,23690,@OCidess You have a fucking anime avi you kissless weeb. No woman would ever marry you. Give up on your hopes and dreams and die.,0.980392157,0.981818182
102,32176,"Men are so fucking useless, it's sickening. The ONLY thing your good for is sending and most of you small brian imbeciles can't even mange to do something as simple as that.  #findom #paypig #sugardaddy #femdom #mistress #domme #goddess #feet @domme_rtslave @DirkHooper URL",0.931034483,0.943396226
103,36137,Seeing how men on twitter treat rape victims is exact the reason why it took me 6 years to come out about what happened to me. Yall are fucking sick and I pray y'all don't have daughters that go through something that traumatizing and that your sons don't pick up your mentality,0.339622642,0.37037037
104,38828,"Look, we get it. Your penises are so small they're basically useless. But you can do other things. Cunnilingus. Adult toys that dont murder everyone. Drop the gun and read a book Cletus.",0.82,0.928571429
