id,comment_id,text,pos_f,pos_m
105,47472,"[MER] Minerstuffed I'm a thot because men like you will never be in my lane? Yeah your blow up sex toy is waiting upstairs for you, fucking basement dweller!",0.946428571,0.947368421
106,39277,"It's always about you isn't it loser? You really must live in an insecure, tiny handed, mushroom penis bubble of narcissism and illiteracy. It won't get better. Your penis I mean, you could learn to read more gooder. ",1,0.942307692
107,36838,At this point his dick already out Imma yank and squeeze the shit out of that muhfucka see if it's funny then biiitch. Then kick him when he's down for being a trash ass person all around,0.981481481,0.963636364
108,29607,YOU ARE PATHETIC  After I take your cash I will make your tiny dick the laughing stock of all My Girlfriends ! Vanilla Girl Humiliation,0.910714286,1
109,8494,"An hour later: ""wow a man looked at my breasts, I felt so humiliated, men are trash and pedophiles and sexist and homophobic and terrorists and drug dealers""",0.821428571,0.851851852
110,21434,@pinkrocktopus He should get a vasectomy or have his testicles removed. This will prevent his rape babies from being aborted. I say that because NOBODY would willingly have sex with this person.,0.888888889,0.901960784
111,12898,"Go back to your cave of taquitos and mt. Dew, neck beard, this is last response youll get out of me. Enjoy knowing the only pleasure you draw in life is from pretending this kind of behavior gives you any power, im sure your mother is proud in hell. ;)",0.846153846,0.916666667
112,36384,@ZugIslander @CHAPOTRAPHOUSE This is why women won't have srx with you. Because you're disgusting pigs who can't contain your contempt for women. Fuck all of you incel motherfuckers.,0.913793103,0.931034483
113,19769,"The old man got lucky that he wasn't beaten until he was left in a puddle of his own piss and vomit. What a moronic, incontinent, geriatric waste of oxygen.",0.981132075,0.945454545
114,23661,"So, Brian is a creep too and just got out. lol. All of you pieces of shit are closet pedophiles. Sorry, 16 year old girls are children. Kill yourselves. URL",0.921568627,0.961538462
115,14136,Last tool in the box trying to make his ugly as fuck pal more attractive to the opposite sex...... he failed! What's that fucking chin about too? Looks like you could wipe your arse and blow your nose at the same time you fucking creepy cunt!,1,1
116,8071,"I'll shove scissors up ur ass and open and close them until your rectum turns into a new ungodly like shape.  Then I'll wrap your dick with the paper and violently stroke it up and down until your dick is red with rage.  Then I'll finally take that big fucking rock and smash it on your balls repeatedly until the two nuts collapse to the floor like a smashing tower, with the adrenaline pumping through my body I will stand over you showing my dominance and eat your two fucking balls, staring you in the eyes. Is this what you thought of, it sure is what I thought of?",1,1
117,3940,"What a total pile of retarded shit this fucker is, smug as fuck for a dirty, depressing, and ugly incel. Always going back to ""your mom"" or ""you suck at secks"" in reply to criticism. Josh, you haven't even got to TRY to find the ""walnut"" in almost two full years you stinky bald man child.  Your dick is almost as disgusting as your teeth and gums now, clean your wretched body you fucking stupid fucking moron.",1,1
118,17125,"99% of them are boys who refuse to become better. 1% of them are men who are actually getting shit done. This 1% is either grinding 24/7 & enthralled in their work or they're just getting really sick of the state of women these days.  ​ **Incels don't exist.** *If they REALLLLLY wanted to,* these losers could always fuck Diabetty, the 400 lb amputee down the street or anything equally horrendous. **They are voluntarily celibate.**",0.943396226,0.941176471
119,9477,They're all meth heads now. I guess that's what qualifies as being a real man to something like you? Cuckold? That insult doesn't even make sense.  You're too stupid to live. I can't wait until we start hunting you cunts.,1,0.96